nome_professor,resumo_professor,formacoes_academicas,projetos_pesquisa,coautores_publicacoes,colaboradores_projetos
Carlos Eduardo Coelho Freire Batista,"Professor Associado do Centro de Informática da Universidade Federal da Paraíba desde 2013, é Doutor em Informática pela Pontíficia Universidade Católica do Rio de Janeiro (PUC-Rio, 2013). Possui graduação em Ciências da Computação pela Universidade Federal da Paraíba (2004) e mestrado em Informática pela Universidade Federal da Paraíba (2008), sendo membro do Laboratório de Aplicações de Vídeo Digital (LAViD) desde 2003. Realizou pós-doutorado na University of California, San Diego (2017), trabalhando na área de computação musical. Atualmente é coordenador do Programa de Pós-Graduação em Computação, Comunicação e Artes. É pesquisador colaborador do Laboratório Telemídia da PUC-Rio e co-autor das especificações do middleware Ginga, participando do Grupo de Trabalho de Middleware do Forum Brasileiro de TV Digital e também atuando no processo de padronização internacional das tecnologias relacionadas junto à União Internacional de Telecomunicações (UIT). Tem experiência na área de Ciência da Computação, com ênfase em Sistemas Multimídia, atuando principalmente nos seguintes temas: Sistemas Multimídia Distribuídos, TV digital interativa, Vídeo e Áudio Digital e Música Computadorizada.","Doutorado (2008 - 2013): Doutorado em Informática. Pontifícia Universidade Católica do Rio de Janeiro, PUC-Rio, Brasil. Título: GINGA-MD: Uma Plataforma para Suporte à execução de Aplicações Hipermídia Multi-Dispositivo Baseada em NCL, Ano de obtenção: 2013. Orientador: Luiz Fernando Gomes Soares. Bolsista do(a): Coordenação de Aperfeiçoamento de Pessoal de Nível Superior, CAPES, Brasil. Palavras-chave: Sistemas Multimídia; TV Digital Interativa; Sistemas Distribuídos; Hipermídia distribuída; NCL.Grande área: Ciências Exatas e da TerraGrande Área: Ciências Exatas e da Terra / Área: Ciência da Computação / Subárea: Sistemas de Computação / Especialidade: Teleinformática. | Mestrado (2006 - 2008): Mestrado em Informática. Universidade Federal da Paraíba, UFPB, Brasil. Título: TVGrid - Computação em grid em uma Rede de TV Digital, Ano de Obtenção: 2008.Orientador: Guido Lemos de Souza Filho.Palavras-chave: Sistemas Distribuídos; Sistemas Multimídia; TV Digital; Grid.Grande área: Ciências Exatas e da TerraGrande Área: Ciências Exatas e da Terra / Área: Ciência da Computação / Subárea: Sistemas de Computação / Especialidade: Teleinformática. | Graduação (2000 - 2004): Graduação em Ciências da Computação. Universidade Federal da Paraíba, UFPB, Brasil. Título: J.D-VoD: Usando um serviço de armazenamento em rede para distribuir vídeo sob demanda. Orientador: Guido Lemos de Souza Filho. | Técnico/Profissionalizante (1997 - 2000): Curso técnico/profissionalizante em Informática. Instituto Federal de Educação, Ciência e Tecnologia da Paraíba - IFPB, IFPB, Brasil.","Inteligência Artificial para Segmentação e Classificação de Trechos Musicais em Colaboração com a Moises Systems (2022 - Atual) - Situação: None | Descrição: Este projeto representou uma colaboração inovadora entre os prestigiosos laboratórios LAViD (Laboratório de Aplicações de Vídeo Digital) e ARIA (Laboratório de Aplicações em Inteligência Artificial), em conjunto com a Moises Systems, desenvolvedora do aplicativo Moises. O principal objetivo deste projeto é conduzir uma pesquisa aprofundada e desenvolver soluções avançadas baseadas em inteligência artificial para a segmentação precisa e classificação criteriosa de trechos musicais. Por meio da aplicação de técnicas de aprendizado de máquina, o projeto deseja desenvolver ferramentas que sejam uma extensão natural das capacidades dos intérpretes e compositores, enriquecendo e agilizando suas atividades de estudo e criação. A segmentação eficiente de trechos musicais, permite que usuários explorem, subvertam e destaquem seções específicas de músicas, para análise e estudo musical. Além disso, a classificação precisa dos trechos, levando em consideração nuances emocionais, rítmicas e tonais, permite uma melhor compreensão de estruturas e arranjos musicais. As soluções propostas no projeto devem servir de base para ferramentas utilizadas por músicos, sejam eles intérpretes ou compositores, para expandir e facilitar o processo criativo, ao invés de serem usadas como um serviço de produção completa.. () - Situação: Em andamento | PARAÍBA HUMANA E INTELIGENTE (PHI) - CINE MODELO (2021 - 2023) - Situação: None | Descrição: Projeto Paraíba Humana e Inteligente (PHI) tem por objetivo propor o desenvolvimento de um conjunto de soluções digitais para o governo da Paraíba nas áreas de acessibilidade, gestão cidadã e engajamento e interação digital. Tais serviços serão aplicados inicialmente no contexto da Secretaria da Educação, Ciência e Tecnologia do Governo da Paraíba, mas que poderão ser ampliados para outras secretarias do governo, considerando os resultados alcançados ao longo das pesquisas. O escopo do projeto contempla 7 (sete) pacotes de trabalho (do inglês, Work Package ou WP) que compreendem a coordenação do projeto e soluções a serem implantados no espaço interativo: Gerência de Projeto (WP1), Mapeamento (WP2), Acessibilidade Digital (WP3), Cine Modelo (WP4), Gestão Participativa (WP5), Engajamento Digital (WP6) e Interação Digital (WP7). O Cine Modelo contempla atividades de desenvolvimento de um conjunto de cadeiras de natureza multi-sensorial, como uma evolução da cadeira Auris Chair, prototipada previamente pelo LAViD no escopo do projeto VLibras. As cadeiras serão desenvolvidas com recursos para prover uma forma inédita de percepção musical para pessoas surdas. Através de dispositivos acoplados à cadeira torna-se possível a representação, através de outros sentidos que não a audição, de elementos musicais como arranjo, ritmo e melodia, além de elementos sonoros presentes em filmes e outras peças audiovisuais. O sistema que dá suporte à nova versão Auris Chair integrará (assim como sua primeira versão) mecanismos de testes baseados na leitura de dados de Eletroencefalografia (EEG), em busca de mecanismos que permitam a otimização do oferecimento recursos para representação musical. O experimento piloto da nova versão da Auris Chair prevê que estas sejam instaladas na sala de cinema da Fundação Espaço Cultural José Lins do Rêgo (Cine Banguê - FUNESC), para que sejam utilizadas durante sessões de cinema com suporte a acessibilidade. O suporte à acessibilidade do experimento piloto contará também com um equipamento de tecnologia assistiva voltada à fruição dos recursos de legenda descritiva, áudio descrição e LIBRAS na modalidade fechada individual, atendendo aos requisitos da Instrução Normativa No 128/2016 da ANCINE e da Lei Brasileira de Inclusão (Lei No 13.164/2015). O modelo de Cinema Acessível proposto é inédito no país, sendo capaz de proporcionar às pessoas surdas uma experiência sensorial mais rica e imersiva.. () - Situação: Concluído | COMBINANDO PROGRAMAÇÃO VISUAL E IMPERATIVA PARA SÍNTESE E MANIPULAÇÃO DE ÁUDIO DIGITAL (2020 - Atual) - Situação: None | Descrição: Novos cenários de execução e produção sonora e musical surgiram na última década em função da consolidação da digitalização dos mecanismos de manipulação de áudio e da massificação da Internet como plataforma de comunicação. A construção colaborativa de artefatos de som e música, com finalidade lúdica ou comercial, já é realidade através de diferentes sistemas, com as mais variadas funcionalidades. O presente projeto visa acoplar os mecanismos previamente desenvolvidos para criação e manipulação áudio digital através de programação imperativa com o ambiente de programação visual Pure Data. Através desta integração, objetiva-se oferecer novos cenários para execução e produção sonora e musical, com foco em suporte à atividades de programação musical em tempo real (live coding), em formato individual (offline) e coletivo (em rede).. () - Situação: Em andamento | Interação Cérebro Computador como meio para melhorar a recomendação de conteúdos audiovisuais em sistemas de vídeo sob demanda (2020 - Atual) - Situação: None | Descrição: O objetivo do projeto é o desenvolvimento de um sistema de recomendação de conteúdos baseado na interação neural. Pretende-se usar, inicialmente, a touca EMOTIV EPOC +, um sistema EEG portátil, de alta resolução,para a leitura dos sinais elétricos em diferentes pontos durante a fruição fílmica. Com estes dados pretende-se identificar momentos em que o indivíduo gosta do filme e momentos em que ele desgosta e relacionar estes períodos com os roteiros. Como resultado, criar padrões que possam subsidiar a recomendação de novas obras. Para tanto, pretende-se fazer um estudo aprofundado da evolução das interfaces de interação, especialmente sobre as mudanças comportamentais, e a consequente mudança na fruição dos conteúdos que as novas tecnologias ensejaram. Além disso, será necessária uma revisão sistemática da literatura para mapear as tecnologias e ferramentas utilizadas atualmente na ICC, assim como as limitações mais relevantes. Com estas duas pesquisas teremos uma base sólida para a prototipagem, implementação e teste do sistema a ser desenvolvido.. () - Situação: Em andamento | SÍNTESE E MANIPULAÇÃO DE ÁUDIO DIGITAL A PARTIR DE UMA INTERFACE DE PROGRAMAÇÃO IMPERATIVA (2019 - 2020) - Situação: None | Descrição: A digitalização dos mecanismos de produção e distribuição audiovisual foi crucial para a democratização do acesso aos mecanismos para produção de mídia, que são facilitados por computadores em sistemas cada vez mais simples. O presente projeto visa criar mecanismos para criação e manipulação áudio digital a partir de uma interface de programação imperativa, utilizando recursos da biblioteca LibPD e da linguagem Pure Data. Pure Data é uma linguagem de programação visual utilizada para criação de programas com foco em manipulação de áudio e vídeo, e LibPD é uma biblioteca de programação que permite a utilização dos recursos de Pure Data em outros ambientes de programação. A presente proposta de projeto contempla, portanto, o desenvolvimento de um software capaz de interpretar comandos imperativos para criação de programas (patches) Pure Data, com foco na geração e manipulação de áudio digital. Este software poderá ser executado de forma autônoma ou acoplado à ferramentas de edição de áudio através de uma extensão (plug-in) seguindo o padrão VST (Virtual Studio Technology).. () - Situação: Concluído | TCE Interativo (2018 - 2019) - Situação: None | Descrição: Este projeto visa o aumento do engajamento da população nas atividades de fiscalização de obras e prestação de contas do TCE/PB por meio do desenvolvimento de um espaço interativo onde a sociedade possa visualizar os dados do trabalho realizado pelo tribunal de forma lúdica e interativa, fazendo o uso de tecnologias de realidade virtual e aumentada, aplicativos multimídia interativos e conteúdos dinâmicos em plataformas de execução fixas, móvel e Web. Além de um canal para a participação ativa da população como fiscalizadora de obras e gastos, auxiliando o TCE/PB na execução de suas competências e alimentado o espaço com dados em tempo real.. () - Situação: Concluído | VLibras (Música para Surdos) (2014 - Atual) - Situação: None | Descrição: O objetivo geral do projeto é o desenvolvimento de uma Suíte de ferramentas computacionais, denominada Suite VLibras, que permita que conteúdos em LIBRAS possam ser gerados automaticamente em Desktops, dispositivos móveis e plataformas Web, tornando-as acessíveis para pessoas surdas. O projeto é financiado pela Secretaria de Logística e TI (SLTI) do Ministério do Planejamento, Orçamento e Gestão, e tem o apoio da Secretaria de Direitos Humanos da Presidência da República (SDH/PR) e da Rede Nacional de Ensino e Pesquisa (RNP), e a idéia é ter uma solução livre e aberta que permita que a comunidade surda tenha acesso a sites do Governo Federal, e sites comerciais. () - Situação: Em andamento | Grupo de Trabalho de Sincronismo de Música em Rede (GT-SiM) (2013 - 2015) - Situação: None | Descrição: O Grupo de Trabalho de Sincronismo de Música em Rede deseja analisar todos os aspectos técnicos envolvidos na realização de atividades de música em rede e construir mecanismos para manipulação de estratégias para transmissão de áudio com baixíssimo retardo. O Grupo de Trabalho desenvolverá uma plataforma de software para experimentação musical em rede, com mecanismos facilitadores para a composição, execução e reprodução de peças musicais que envolvem músicos e elementos musicais distribuídos geograficamente, interconectados através do backbone da RNP. A plataforma define mecanismos facilitadores para o estabelecimento de requisitos e restrições de sincronismo entre os elementos envolvidos em uma peça musical, cuja execução e reprodução utilizam múltiplos pontos remotos de entrada e saída de áudio.. () - Situação: Concluído | PALCO (2012 - 2014) - Situação: None | Descrição: O projeto PALCO estuda os aspectos de utilização de tecnologias inovadores em redes híbridas (""broadband e broadcast"") no suporte a serviços e aplicações multimídia avançadas, e o desenvolvimento desses serviços e aplicações. PALCO tem como foco o ?serviço de TV digital em redes híbridas?, mas sempre procurando a generalização dos resultados obtidos. Por redes híbridas entende-se redes com serviço IPTV (broadband TV) e serviços de TV por difusão (broadcast) interoperando.. () - Situação: Concluído | Laboratorium MAPA D2 (2011 - 2012) - Situação: None | Descrição: O projeto LABORATORIUM MAPA D2 visa promover a articulação de um agregado de ?laboratórios? (grupos de pesquisa acadêmicos e coletivos artísticos) tanto pelo meio virtual como por encontros presenciais para a investigação sobre o potencial das novas Tecnologias de Informação e Comunicação (TICs) e do audiovisual para a criação de produtos artísticos.
Visa também promover a investigação, exploracão e aplicabilidade das TICs para o desenvolvimento de performances telemáticas envolvendo ambiente virtual, interatividade e os diversos campos artísticos (dança, performance, música, visuais, cinema, arte tecnologia, etc)
Desta forma, não se trata de pesquisar a rede como um ambiente apenas para a transmissão de informação, mas como um meio próprio que determina as condições artísticas e estéticas específicas das obras artísticas a serem criadas.. () - Situação: Concluído | CAPES RH-TVD (2008 - 2012) - Situação: None | Descrição: Formação de Recursos Humanos Qualificados para Pesquisa e Desenvolvimento de Ferramentas e Aplicações para Sistemas de Televisão Digital.. () - Situação: Concluído | BEACON (2007 - 2009) - Situação: None | Descrição: BEACON is the acronym for Brasilian-European Consortium for DTT Services . It is a specific targeted research project on Digital Terrestrial Television carried out with the support of the European Commission under the Sixth Framework Programme Priority IST. Between 2007 and 2010 BEACON aims to develop innovative t-learning pilot services related to social inclusion in the State of Sao Paulo (Brasil) on the basis of pioneering research on interoperability between the European (DVB) and the Brazilian (SBTVD) Digital Terrestrial Television standards and the definition of a pedagogically sound methodology for distance learning through digital television. Ultimately the project will establish a Brasilian-European Consortium which will manage the exploitation of the assets and the services implemented by the project activities. Although e-learning is an all-encompassing term used in reference to learning through any electronic device , it is most commonly used for computer-enhanced learning. As a subset of e-learning, t-learning or learning through digital interactive television (IDTV) can prove highly beneficial however to regions where access to internet-enabled computers is significantly low. Research reveals that the large majority of today s households own a television rather than a computer. In the context of Latin-America these numbers are even more critical: while 95% of the Brasilian households have a television, less then 20% owns an internet-enabled computer. For the lowest economic classes (D and E) access to computers or internet is even lower than 2%. The exploitation of this potential is therefore undeniably important for the implementation of relevant educational policies. The success and steady growth of tLearning services will depend primarily on factors as effectiveness and reliability .. () - Situação: Concluído | Ginga Middleware para o Sistema Brasileiro de TV Digital (2006 - 2009) - Situação: None | Descrição: Este projeto tem como objetivo principal o desenvolvimento de uma implementação de referência do middleware Ginga. Este middleware foi definido como sendo o middleware parão do SBTVD (Sistema Brasileiro de TV Digital). O projeto prevê também a elaboração das especificações que serão usadas para realização de testes de conformidade dos middlewares dos equipamentos SBTVD desenvolvidos para serem comercializados no Brasil.. () - Situação: Concluído | FlexTV - Desenvolvimento de Middleware para o Sistema Brasileiro de Televisão Digital (SBTVD) (2005 - 2006) - Situação: None | Descrição: Em um sistema de televisão digital, o subsistema de difusão e acesso é constituído pelos módulos que propiciam a geração e empacotamento das informações a serem transmitidas para os usuários, enquanto os módulos contidos no subsistema terminal de acesso efetuam o processamento necessário para os usuários possam desfrutar das informações transmitidas. Um dos componentes do terminal de acesso do sistema de televisão digital é o middleware. As principais funções de um middleware para tlevisão digitial interativa são: possibilitar a execução de aplicações, fornecendo para as mesmas um conjunto de APIs bem definido, abstraindo características específicas de hardware e de sistema operacional; e fornecer serviços para essas aplicações tais como, serviços de comunicação, acesso a fluxos elementares de áudio, vídeo e dados. O projeto FlexTV é um dos subprojeto do projeto do Sistema Brasileiro de Televisão Digital. O FlexTV tem por objetivo principal a concepção de uma arquitetura conceitual de um middleware e a definição de APIs para programas de televisão interativos que serão avaliadas pelo Governo Brasileiro e, caso aprovadas, utilizadas como parte do Modelo de Referência do Sistema Brasileiro de Televisão Digital. O projeto prevê a elaboração de análises tecnológicas e econômicas de modo a subsidiar a definição de um modelo de referência adequado às necessidades da população brasileira. A arquitetura e as APIs propostas serão validadas através da implementação de um protótipo do middleware e de aplicações residentes no terminal de acesso do sistema de televisão digital. O projeto prevê ainda a realização de testes de integração do middleware com resultados de outros sub-projetos do projeto do Sistema Brasileiro de Televisão Digitral: aplicações, serviço de saúde, transmissão, camada de transporte, terminal de acesso, entre outros.. () - Situação: Concluído | HITV - Desenvolvimento de Software e Hardware para Sistemas de Televisão Digital de Alta Definição (2003 - 2006) - Situação: None | Descrição: Desenvolvimento de Software e Hardware para Sistemas de Televisão Digital de Alta Definição. () - Situação: Concluído | Algoritmo de aprendizagem para uma rede neural artificial direta. (2001 - 2002) - Situação: None | Descrição: Algoritmo de aprendizagem para uma rede neural artificial direta. () - Situação: Concluído","ALMEIDA, A. E. M.; ALVES ARAUJO, FELIPE 2017 ALVES ARAUJO, FELIPE; ALVES, F.; ALVES, G. S.; ALVES, L. G. P.; AMORIM, B. P.; ANDRADE, GABRIEL B. F.; ANJOS, T. C.; ARAUJO, E. C.; ARAÚJO, T. M. U. de; AZEVEDO, F. M.; AZEVEDO, R. G.; BATISTA, CARLOS; BATISTA, CARLOS E. C. F.; BATISTA, CARLOS EDUARDO COELHO FREIRE; BATISTA, CARLOS EDUARDO FREIRE; BATISTA, GILMÁRIO RICARTE; BELTRAME, JUCIANE ARALDI; BRANDAO, R. R. M.; BRASIL, L. M.; BRASILEIRO, F. V.; BRESSAN, G.; BRITO, F. S. M.; CAMPOS, P. G.; CANDIDO LIMA SANTOS, ALLISON; CARVALHO, M. G.; CASTRO, G. M. L. de; CIRNE, L.; CIUFFO, LEANDRO; COSTA, L. F. S.; COUTINHO, G. L. O.; DA SILVA, CICERO INACIO; DA SILVA, JÚLIO CÉSAR GOMES 2023 DA SILVA, JÚLIO CÉSAR GOMES; DE ALMEIDA, JANE 2014 DE ALMEIDA, JANE; DE AQUINO JUNIOR, LUCENILDO LINS; DE SOUSA BATISTA JUNIOR, LUZENILDO; DE SOUZA FILHO, GUIDO LEMOS; DIAS, C. E. S.; DOWLING, C. F. B. 2022 DOWLING, C. F. B.; EDUARDO COELHO FREIRE BATISTA, CARLOS; FALCAO, P. T.; FERREIRA, F.; FILHO, M. T. B.; GOMES, A. L.; GUEDES, A. L. V.; GUEDES, CAIO M. C.; GUIMARAES, A. P. N.; HAGEWOOD, M. H.; JUNIOR, L. F. A.; KULESZA, R.; LEITE, L. E. C.; LEITE, L. E. C. 2005 LEITE, L. E. C.; LIMA BRASIL, FABRICIO; LIMA, G. F.; LIMA, GEOVANA M. S.; LUCENA, R. L. B. G.; MACHADO, IARA; MATSUBARA, F.; MELO. G. E. L. de; MORENO, M. F.; NETO, MANOEL SILVA; OLIVEIRA, F. S.; OLIVEIRA, M. R.; OMAIA, D.; PATRÍCIO, GABRIEL TEIXEIRA; PEREIRA FONSECA DUTRA, SAVIO; REIS DA SILVA, CLAYTON; RIOS, R.; RODRIGUES, R. F.; ROJAS, J. C. C.; SALES, THIAGO 2021 SALES, THIAGO; SALMITO, T. L.; SANTOS, DONATELY; SCHWABE, D.; SILVA, F. P. R.; SILVA, I. G. L.; SILVA, KALINNE FERNANDES; SILVA, L. D. N.; SILVA, L. D. N. 2007 SILVA, L. D. N.; SILVA, L. H. P.; SILVA, O. L.; SILVEIRA, G. E.; SOARES, L. F. G.; SOUSA, J. W. C. de; SOUZA FILHO, G. L. de; SOUZA FILHO, G. L. de 2007 SOUZA FILHO, G. L. de; SÁ, CAIO 2019 SÁ, CAIO; VILAROUCA FILHO, J. I. B.; VILAROUCA FILHO, JOSE IVAN",Adilson Barboza Lopes; André Maurício Cunha Campos; Antônio Carlos Cavalcanti; Augusto Cézar Camarotti de Lima; Bruno Pereira Amorim; Caio Marcelo Campoy Guedes; Carlos Eduardo Silveira Dias; Clodoaldo Brasilino Leite Neto; César Augusto Perdigão Batista; Daniel Gambaro; Daniel Sorrentino; Derzu Omaia; Ed Porto; Edna Brennand; Esmeraldo Marques Pergentino Filho; Eupólemo Holanda de Castro; Felipe Alves; Felippe Nagato; Fernanda Paulinelli Rodrigues Silva; Frederico Borelli de Souza; Gabriel Ferraz; Gilberto Farias de Sousa Filho; Glêdson Elias da Silveira; Guido Lemos de Souza Filho; Guilherme de Souza Alves; Guto Nóbrega; Hamilton Soares da Silva; Ismênia Galvão Lourenço da Silva; Ivan Saraiva Silva; Ivani Lúcia Oliveira de Santana; Jaelson Lima de Carvalho Jr; Jean Carlos Cabrera Rojas; Jean Felipe Fonseca de Oliveira; Jorge Henrique Cabral Fernandes; José Adson Oliveira Guedes da Cunha; José Antônio Gomes de Lima; João Vittor Souza; Leonardo Henrique Pina da Silva; Leonardo Vidal Batista; Lincoln David Nery e Silva; Lourdes Mattos Brasil; Luiz Eduardo Cunha Leite; Luiz Fernando Gomes Soares; Luiz Gonzaga da Silva Filho; MARIA CATARINA SERRANO DE LACERDA; Milano Gadelha Carvalho; Márcio Ferreira Moreno; Mário César Heliodoro Arruda; Mônica Magalhães Pereira; Nycholas de Sousa; Ozifrankly Lima da Silva; Paulemir Gonçalves Campos; Rafael Rossi Melo Brandão; Raoni Kulesza; Rodolfo Emanuel Lima Serrano; Rodrigo Barbosa Costa de Carvalho; Rodrigo Soares de Lima Sá Rêgo; Solon Ferreira de Lucena Júnior; Tatiana Aires Tavares; Thais Gaudêncio do Rego; Thiago José M Moura; Tiago Lima Salmito; Tiago Maritan Ugulino de Araújo; Valdecir Becker; Walmeri Ribeiro; Yuri de Almeida Malheiros Barbosa; Évisson Fernandes de Lucena
