nome_professor,resumo_professor,formacoes_academicas,projetos_pesquisa,coautores_publicacoes,colaboradores_projetos
Adriana Carla Damasceno,"Possui graduação em Ciência da Computação pela Universidade Federal da Paraíba (2003) e Tecnologia em Telecomunicações pelo Centro Federal de Educação Tecnológica da Paraíba (2004), Mestrado em Ciência da Computação (2008) pela UFPE, Doutorado em Ciência da Computação na UFCG (2015) e MBA em Gestão Empreendedora e Inovação (2019) na UFCG. Foi professora de diversas faculdades particulares (2006-2009), da UFCG (2009-2021) e do Centro de Informática da UFPB (2021-dias atuais). Coordenou diversos projetos de extensão com foco em escolas de ensino médio e micro e pequenos empresários. Além disso, também realizou pesquisas na área de Ciência da Computação, atuando nos seguintes temas: 1) engenharia de software, 2) gestão de projetos, 3) informática na educação e 4) Ciência de Dados. Desde 2018, é avaliadora do MEC em cursos na área de Ciência da Computação, credenciamento e recredenciamento de Instituições de Ensino Superior. Mais informações podem ser encontradas em meu LinkedIn https://www.linkedin.com/in/adri-ana-carla/","Doutorado (2011 - 2015): Doutorado em Ciência da Computação. Universidade Federal de Campina Grande, UFCG, Brasil. Título: Towards a Test Generation Approach for Compositional Real-Time Systems, Ano de obtenção: 2015. Orientador: Patrícia Duarte de Lima Machado. Coorientador: Wilkerson de Lucena Andrade. | Mestrado (2006 - 2008): Mestrado em Ciências da Computação. Universidade Federal de Pernambuco, UFPE, Brasil. Título: Geração mecanizada de abstrações seguras para especificações CSP, Ano de Obtenção: 2008.Orientador: Alexandre Cabral Mota.Coorientador: Adalberto Cajueiro Farias. Bolsista do(a): Coordenação de Aperfeiçoamento de Pessoal de Nível Superior, CAPES, Brasil. | Especialização (2018 - 2019): Especialização em MBA em Gestão da Inovação e Empreendedorismo. (Carga Horária: 360h). Universidade Federal de Campina Grande, UFCG, Brasil. Título: Plano de negócios para emissão de NFC-e. Orientador: Vinicius Farias Moreira. | Aperfeiçoamento (2003 - 2004): Aperfeiçoamento em Análise de Testes. (Carga Horária: 520h). Universidade Federal de Pernambuco, UFPE, Brasil. Título: Babel: uma Ferramenta de Conversão de Protocolos. Ano de finalização: 2004. Orientador: Augusto Cezar Alves Sampaio. Bolsista do(a): Fundação de Apoio ao Desenvolvimento do Estado de Pernambuco, FADE, Brasil. | Graduação (2001 - 2004): Graduação em Tecnologia Em Telecomunicações. Instituto Federal de Educação, Ciência e Tecnologia da Paraíba - IFPB, IFPB, Brasil. Título: Análise de Testes em Aparelhos Celulares de Tecnologia GSM. Orientador: Leonidas Francisco de Lima Junior. | Graduação (1999 - 2003): Graduação em Ciência da Computação. Universidade Federal da Paraíba, UFPB, Brasil. Título: Documentação da rede do CEFET/PB: Estudo da Rede Atual e Sugestões para um Plano de Segurança. Orientador: Guido Lemos de Souza Filho. | Técnico/Profissionalizante (1995 - 1998): Curso técnico/profissionalizante. Instituto Federal de Educação, Ciência e Tecnologia da Paraíba - IFPB, IFPB, Brasil.","Criação e análise de um modelo de boas práticas para startups de software (2022 - Atual) - Situação: None | Descrição: Startups de software possuem grande poder de empregabilidade, mas as taxas de insucesso deste tipo de empreendimento são cada vez maiores. Dentre os fatores que auxiliam neste contexto está a falta adoção de modelos de boas práticas para o desenvolvimento deste tipo de software, o que aumenta o retrabalho e contribui para o aumento de custos deste projeto. Alguns modelos propostos em engenharia de software são usados neste contexto, no entanto as particularidades de startups de software não são levadas em consideração. Este trabalho visa responder a seguinte pergunta de pesquisa: Como podem ser criados modelos de boas práticas para startups de software focado em requisitos, arquitetura e testes? Os resultados desta pesquisa poderão ser usados em startups de software, além de contribuir para atingir os Objetivos de Desenvolvimento Sustentáveis Indústria, inovação e infraestrutura e Consumo e produção responsáveis. () - Situação: Em andamento | Definição de critérios para a medição de débito técnico em startups de software (2022 - Atual) - Situação: None | Descrição: Startups de software são extensamente usadas de forma inovativa e contribuem para a inovação de emprego. No entanto, durante as fases do desenvolvimento da startup, não são usados métodos de desenvolvimento de software, o que aumenta o custo de retrabalho no futuro, isto é, o débito técnico em startups de software. Com isso, a possibilidade de insucesso da startup aumenta consideravelmente, uma vez que a evolução do software é prejudicada neste contexto. Diante disso, surge a seguinte questão de pesquisa: Como adaptar uma ferramenta existente para medição de débito técnico em startups de software? Este trabalho visa adaptar os critérios objetivos de débito técnico e ferramentas existentes de medição em engenharia de software para o contexto de startups de software. Com estas medições, será possível monitorar a qualidade do software desenvolvido e aumentar as probabilidades de sucesso em startups de software. Os resultados desta pesquisa poderão ser usados em startups de software, além de contribuir para atingir os Objetivos de Desenvolvimento Sustentáveis Indústria, inovação e infraestrutura e Consumo e produção responsáveis.. () - Situação: Em andamento | Um processo de testes de software para projetos acadêmicos (2021 - 2022) - Situação: None | Descrição: Os testes de software fazem parte do campo da linha de pesquisa Engenharia de Software, uma parte da subárea de pesquisa Metodologia e Técnicas de Computação. Eles são usados para aumentar a qualidade do software e diminuir os custos em seu projeto, contribuindo para a satisfação do usuário final. Testes ágeis permitem a adoção de boas práticas para a entrega do software em versões incrementais e testadas conforme estabelecido no início do projeto, sendo adequados a projetos com escopo instável. Projetos de software acadêmicos podem ser beneficiados neste contexto porque projetos de pesquisa frequentemente buscam o ineditismo, o que gera a incerteza do escopo estabelecido inicialmente no projeto. Aliado a isso, projetos acadêmicos continuam sendo executados no contexto da pandemia do COVID-19, o que gerou restrições de isolamento, adoção de trabalho remoto e restrições de custos. Estima-se que o trabalho remoto passará a ser uma tendência de trabalho a ser adotada para depois de terminada a pandemia. Diante disso, surge a seguinte questão de pesquisa: Como pode ser criado um processo de testes ágeis no contexto de projetos de software acadêmicos para times remotos? Os resultados desta pesquisa poderão ser usados em projetos acadêmicos de software de graduação e pós-graduação e maximizar os recursos alocados para estes projetos, além de contribuir para atingir os Objetivos de Desenvolvimento Sustentáveis Indústria, inovação e infraestrutura e Consumo e produção responsáveis. () - Situação: Concluído | Geração de testes para sistemas de tempo real usando operadores composicionais (2020 - 2021) - Situação: None | Descrição: Sistemas de tempo real são usados em monitoramento de pacientes, celulares e sistemas embarcados. Eles necessitam de testes que incluem o fator tempo, requerendo maior rigor nesta fase. Os teste baseados em modelos podem ser usados para diminuir os custos para encontrar falhas neste tipo de sistema. No entanto, a complexidade inerente a este tipo de software ainda apresenta custos elevados. Uma solução seria a adoção de testes baseados em modelos que possam ser usados para compor sistemas mais complexos, ao mesmo tempo em que diminui a complexidade do software. Esta proposta visa a adição de dois operadores composicionais a um framework existente, a geração automática de testes a partir do modelo composto por estes operadores e a avaliação desta abordagem em um estudo de caso. () - Situação: Concluído | Abordagens de Aprendizado para Iniciantes em Programação (2015 - 2019) - Situação: None | Descrição: Várias são as dificuldades durante o ensino de disciplinas de Introdução à Programação, o que ocasiona altos índices de reprovação e evasão. Muitos trabalhos foram desenvolvidos para contribuir com a melhora desse quadro. Entretanto, não existem iniciativas na literatura que realizem um agrupamento e comparação entre eles. O objetivo desse projeto é realizar um agrupamento das abordagens de aprendizado para iniciantes em programação, aplicando-as a alunos de cursos de Engenharia. () - Situação: Concluído | Teste Baseado em Modelos Simbólicos para Sistemas Embarcados de Tempo Real (CNPq Universal) (2011 - 2014) - Situação: None | Descrição: Sistemas de tempo real são aqueles cujo correto comportamento não depende somente dos resultados gerados, mas também de quando os resultados são gerados. Muitos desses sistemas são desenvolvidos com propósitos específicos e fortemente acoplados ao hardware e, por isso, são conhecidos como sistemas embarcados de tempo real. Esses sistemas têm se tornado cada vez mais presentes no suporte a execução de atividades críticas, tais como controle, monitoração e tomada de decisões, onde falhas podem resultar em perdas em termos financeiros, ambientais ou humanos. Por isso, confiança é uma importante propriedade que demanda uma aplicação rigorosa das atividades de V & V. O principal objetivo deste projeto é dar suporte ao teste de conformidade, interoperabilidade e robustez no contexto dos sistemas embarcados de tempo real através de uma fundamentação teórica sólida e validação através de teste de software com apoio de ferramentas adequadas. Os resultados obtidos serão aplicados na prática considerando o domínio espacial. () - Situação: Concluído | Geração Mecanizada para Abstrações CSP (2006 - 2009) - Situação: None | Descrição: Infinite models cannot be directly analyzed by model checking. An alternative for achieving that is using data abstraction to derive a simpler (abstract) but finite model so that the properties can be verified using the abstract model instead. This work proposes the study of automatic abstractions for CSP models. () - Situação: Concluído","ALBUQUERQUE, R. S.; ALBUQUERQUE, RENATO; ALVES, I. C. S.; ALVES, L. C.; ALVINO, C.; AMSTALDEN, A. L. F.; ANDRADE, R.; ANDRADE, W. L.; ANDRADE, WILKERSON L.; ASSIS, W. D.; Adriana Damasceno; BARRETO, MAURO; BATISTA, GUSTAVO; CAVALCANTE, A. V. G.; DAMASCENO, ADRIANA C.; DAMASCENO, ADRIANA C. 2017 DAMASCENO, ADRIANA C.; DANTAS, B. C. S.; DANTAS, RAUCY; DINIZ, A. A. R.; DINIZ, AMANDA; Damasceno, Adriana; FERNANDES, I.; Farias, Adalberto; Farias. A.; GONCALVES, S. M. N.; JUNIOR, MAURO; LOPES, M. K. C.; LOPES, MAYRLLA; MACHADO, PATRICIA D. L.; MASCENA, LUCAS; MATOS, T. O.; MORAIS, J. B. O.; MOREIRA, F.; MOREIRA, J. A.; MOTA, A.; MOURA NETO, J. B.; MOURA, N. L. S.; Machado, P. D. L.; Mota, Alexandre; NASCIMENTO JUNIOR, J. P.; NOBREGA, S.; PEREIRA, F. T.; SANTOS, T.; SCHRAMM, F.; SCHRAMM, FERNANDO; SCHRAMM, V. B.; SCHRAMM, V. B. 2023 SCHRAMM, V. B.; SILVA, GABRIELLY; SILVA, I. A.; SILVA, V. M. L.; SILVA, VANESSA B. S.; TORRES, FELIPE; TORRES, W. N.; VELOSO, G. R.; VIEIRA, P. R. M.",ALLAN LEANDRO FERNANDES; Adalberto Cajueiro Farias; Alexandre Mota; CANDIDO LEANDRO DE QUEIROGA BISNETO; Francisco Gustavo Gomes Rolim; GUSTAVO HENRIQUE MAIA DIAS; MARCOS DANTAS GUIMARAES FILHO; MAYRA DAHER DE CARVALHO PEREIRA; Matheus Patrick Araujo da Silva; NATAN ATAIDE DE SOUZA; Patrícia Duarte de Lima Machado; Wesley Nunes Torres; Wilkerson Lucena de Andrade
Alan Kelon Oliveira de Moraes,"Possui graduação em Ciência da Computação pela Universidade Federal da Paraíba (2005), mestrado em Ciência da Computação pela Universidade Federal de Pernambuco (2007) e doutorado em Ciência da Computação pela Universidade Federal de Campina Grande (2017). Atualmente é professor do Centro de Informática da Universidade Federal da Paraíba. Tem experiência na área de Engenharia de Software, sendo especialista em Teste de Software.","Doutorado (2013 - 2017): Doutorado em Ciência da Computação. Universidade Federal de Campina Grande, UFCG, Brasil. Título: On the Influence of Test Adequacy Criteria on Test Suite Reduction for Model-Based Testing of Real-Time Systems, Ano de obtenção: 2017. Orientador: Patricia Duarte de Lima Machado. Coorientador: Wilkerson de Lucena Andrade. | Mestrado (2005 - 2007): Mestrado em Ciências da Computação. Universidade Federal de Pernambuco, UFPE, Brasil. Título: Uma Proposta de Processo de Software para Fábricas deSoftware de Código Aberto, Ano de Obtenção: 2007.Orientador: Silvio Romero de Lemos Meira.Bolsista do(a): Conselho Nacional de Desenvolvimento Científico e Tecnológico, CNPq, Brasil. Palavras-chave: Processo de Software; Software Livre; Fábrica de Software; Qualidade de Software.Grande área: Ciências Exatas e da TerraGrande Área: Ciências Exatas e da Terra / Área: Ciência da Computação. | Graduação (2001 - 2005): Graduação em Ciência da Computação. Universidade Federal da Paraíba, UFPB, Brasil. Título: Sistema de Geração Automática de Trilhos de Aeronaves. Orientador: Lucídio dos Anjos Formiga Cabral. Bolsista do(a): Conselho Nacional de Desenvolvimento Científico e Tecnológico, CNPq, Brasil.","Teste Baseado em Modelos Simbólicos para Sistemas Embarcados de Tempo Real (2013 - Atual) - Situação: None | Descrição: Sistemas de tempo real são aqueles cujo correto comportamento não depende somente dos resultados gerados, mas também de quando os resultados são gerados. Muitos desses sistemas são desenvolvidos com propósitos específicos e fortemente acoplados ao hardware e, por isso, são conhecidos como sistemas embarcados de tempo real. Esses sistemas têm se tornado cada vez mais presentes no suporte a execução de atividades críticas, tais como controle, monitoração e tomada de decisões, onde falhas podem resultar em perdas em termos financeiros, ambientais ou humanos. Por isso, confiança é uma importante propriedade que demanda uma aplicação rigorosa das atividades de V & V. O principal objetivo deste projeto é dar suporte ao teste de conformidade, interoperabilidade e robustez no contexto dos sistemas embarcados de tempo real através de uma fundamentação teórica sólida e validação através de teste de software com apoio de ferramentas adequadas. Os resultados obtidos serão aplicados na prática considerando o domínio espacial.. () - Situação: Em andamento | TECNICO: Uma ferramenta inteligente de suporte ao ensino de programação. (2011 - 2013) - Situação: None | Descrição: A ferramenta TECNICO objetiva dar suporte ao professores de ensino de programação e algoritmos, através do gerenciamento de disciplinas e do acompanhamento individual dos estudantes. A ferramenta gerencia as turmas e listas de exercícios para o professor, a fim de tenham maior controle sobre o desempenho dos alunos cadastrados em suas respectivas turmas, e o aluno poderá submeter no sistema as soluções das listas para correção automática. Permite ainda ao professor selecionar problemas ainda não resolvidos pelos alunos em diversas bases de dados e acompanhar o desempenho individual de cada. Com base no desempenho individualizado, o sistema recomenda, de forma inteligente, novos problemas de acordo com o perfil e conhecimentos de programação do aluno. Com este mecanismo de recomendação inteligente de novos problemas, objetiva-se motivar o aluno a gradualmente elevar o seu nível de conhecimentos em programação e algoritmos.. () - Situação: Concluído | Uma Proposta de Processo de Software para Fábricas de Software de Código Aberto (2005 - 2007) - Situação: None | Descrição: O desenvolvimento de software aberto/free/libre/open (AFLO) tem despertado uma quantidade significante de interesse dentro da sociedade de Engenharia de Software, especificamente por sua forma de organização e construção de soluções de software, onde o time é distribuído e geralmente utiliza um processo de desenvolvimento ágil.
Fuggetta (2003) postulou recentemente que os sucessos AFLO comumente usados como exemplo contra o desenvolvimento fechado de software são sistemas que, em sua vasta maioria, foram desenvolvidos pela comunidade que os especifica e são facilmente testáveis, pois, na maior parte, cuidam funções básicas de hardware, por exemplo, devices drivers, ou são softwares de propósito geral, como editores de texto e servidores web. A pergunta de Fugetta é: ""e se fosse um sistema de controle de tráfego aéreo?"". Além disto, um obstáculo recorrente para iniciar e coloborar efetivamente em projetos AFLO é a falta de uma descrição formal das atividades e as diferentes fases do ciclo de vida de tais projetos (Senyard & Michlmayr, 2004).
A proposta deste trabalho foi definir de um processo software que desse suporte às fábricas de software AFLO tendo por base os conceitos AFLO e da incorporação de práticas das disciplinas da Engenharia de Software. 
O trabalho partiu do esforço já realizado em desenvolvimento distribuído de software (DDS) por turmas de pós-graduação de semestres passados, analisando seus desempenhos e a qualidade dos projetos realizados. Num segundo momento, foi realizado um levantamento sobre o estado da arte em desenvolvimento AFLO cujo objetivo foi observar quais práticas das disciplinas da Engenharia de Software são utilizadas e como são aplicadas dentro destas comunidades.
Baseado nos resultados tanto teóricos quanto práticos, através de um estudo de casos múltiplos, elaborou-se um modelo de processo de desenvolvimento de software com o objetivo de suportar fábricas de software AFLO. Além disto, definiu-se uma abordagem para a construção. () - Situação: Concluído | Ferramenta de Migração de Serviços para Alta Disponibilidade (2003 - 2005) - Situação: None | Descrição: Um sistema é considerado tolerante a falhas se é capaz de continuar fornecendo seus serviços durante períodos em que alguns componentes estão em falha sem que o usuário perceba este fato. Para implementar tal sistema foi-se necessário criar de três serviços básicos sobre os serviços oferecidos já existentes: Serviço de Pertinência, Serviço de Detecção de Falhas e Serviço de Migração de Serviços. O papel do Serviço de Persistência é manter uma visão única a todos os membros do sistema, onde cada servidor sabe quais serviços estão sendo oferecidos por outros servidores. O Serviço de Detecção de Falhas é o responsável por verificar se os serviços oferecidos estão operando corretamente e reportar possíveis falhas ao Serviço de Persistência, que registra o ocorrido e aciona o Serviço de Migração de Serviços para que o serviço em falha possa ser iniciado em outro servidor com segurança, voltando novamente a estar disponível para os usuários e agora livre dos erros e das falhas anteriores. A implementação do sistema foi feita em principalmente em C++ sobre o Debian/GNU/Linux, utilizando as suas bibliotecas nativas de rede e threads.. () - Situação: Concluído | Física de Sistemas Granulares: Criação de um Ambiente de Alto Desempenho Utilizando o Sistema Operacional Linux (2002 - 2003) - Situação: None | Descrição: Recentemente o estudo de Sistemas Granulares (milhares de grãos) surgiu como uma área de interesse entre os físicos. Preliminarmente, o como estes milhares de grãos podem ser descritos num esquema newtoniano, que exige a solução computacional de um sistema de N equaçõesdiferenciais acopladas, que devem ser resolvidas numericamente. As resoluções dessas equações só são possíveis em supercomputadores porque se fossem revolvidas em computadores simples o tempo gasto poderia chegar a meses. Infelizmente supercomputadores não são facilmente acessíveis dados o seu elevado custo. Para sanar este problema, a bolsa teve por objetivo conseguir meios computacionais a baixo custo. A solução encontrada foi o desenvolvimento de um Cluster Beowulf. A idéia do Beowulf é agrupar computadores comuns de baixo desempenho individual, e reunir seus potenciais a fim de formar um supercomputador. O principal esforço consistiu em criar um ambiente portável, maleável e econômico, se possível com os recursos computacionais já existentes. Portanto desenvolveu-se com a tecnologia de clientes sem disco que possibilita economia, facilidade de manutenção e que mantém a configuração atual dos computadores caso seja necessário. O sistema operacional escolhido foi o Linux, que entre algumas vantagens para este tipo de trabalho podemos citar a estabilidade, boa documentação, ferramentas que auxiliam no desenvolvimento e manutenção, além se ser Livre.. () - Situação: Concluído","ALBUQUERQUE, F. C. B.; ALBUQUERQUE, J. O.; ALMEIDA JUNIOR, I. A.; ALMEIDA, D. R.; ANACLETO, A.; ANDRADE, W. L.; ANDRADE, WILKERSON L.; BARBOSA, Y. A. M.; BEZERRA, E. P.; CAVALCANTE, B. E. S.; CAVALCANTI, A. P. C.; FERNANDES, D. Y. S.; FERREIRA, V. S.; GAMA, E. S.; GUEDES, W. P. S.; GUIMARÃES, R. A.; KOEHLER, V. J. S.; KYOTOKU, M.; LEMOS, M. O. O.; LIMA, A. C. C.; LIMA, E. F. C.; LIMA, J. A. G.; LIMA, T. W. S.; LUCENA, L. R.; LUCENA, M. J. N. R.; MACEDO, A. C. P.; MACHADO, L. S.; MACHADO, P. D. L.; MACHADO, PATRÍCIA D.L.; MARTINS, J. H. A.; MEDEIROS JUNIOR, L.; MEDEIROS, M.; MEIRA, S. R. L.; MELLO, S. R. B.; MENDONÇA, J. C. A.; MENGUE, A.; MORAES, A.; MORAES, A. K. O.; MORAES, ALAN 2016 MORAES, ALAN; MOTA, J. L. T.; MOUSINHO, P. S. P.; MULLER, F. M.; NASCIMENTO, J. R. S.; NOBREGA FILHO, R. G.; NOBREGA JUNIOR, J. C. A.; OLIVEIRA, J. H. L.; OLIVEIRA, R. I.; OLIVEIRA, U. S. C.; OMAIA, D.; PARENTE, R. L.; PAULINO, F. T.; PEREIRA JUNIOR, M. F.; PEREIRA, D. C. B.; PEREIRA, S. C.; PESSOA, B. J. S.; QUEIROZ, V. A.; RIBEIRO, R. A.; ROCHA, R. G. C.; SILVA JUNIOR, R. O.; SILVA NETO, M. G.; SILVA, E. V. F.; SILVA, F. Q. B.; SILVA, H. M.; SILVA, H. S.; TRINDADE, C. C",Adriana Carla Damasceno; Berg Élisson Sampaio Cavalcante; Gleyser Bonfim Guimarães; Jones Oliveira de Albuquerque; Jorge César Abrantes de Figueiredo; José Roberto Soares do Nascimento; Maria de Fátima Mattiello-Francisco; Mauro Kyotoku; Milton Felinto  Pereira Júnior; Patrícia Duarte de Lima Machado; Samantha Karolynne Evangelista Monteiro; Silvio Romero de Lemos Meira; Wesley Nunes Marques Torres; Wilkerson de Lucena Andrade
